{
  "$schema": "../schemas/persona.schema.json",
  "persona_name": "Balanced Showpiece",
  "description": "Balanced performance, reliability, and visual polish.",
  "budget_weights": {
    "gpu": 0.34,
    "cpu": 0.18,
    "motherboard": 0.1,
    "ram": 0.08,
    "storage": 0.08,
    "psu": 0.08,
    "case": 0.09,
    "cooler": 0.05
  },
  "priorities": ["strong gaming performance", "clean aesthetics", "quiet thermals", "reputable power supply"],
  "tone": "measured, design-aware"
}
