{
  "$schema": "../schemas/persona.schema.json",
  "persona_name": "Upgrade Path",
  "description": "Future-proof platform choices with sensible headroom.",
  "budget_weights": {
    "gpu": 0.3,
    "cpu": 0.17,
    "motherboard": 0.13,
    "ram": 0.08,
    "storage": 0.07,
    "psu": 0.11,
    "case": 0.08,
    "cooler": 0.06
  },
  "priorities": ["modern socket and DDR generation", "PSU headroom", "case clearance", "extra M.2 slots"],
  "tone": "practical, long-term focused"
}
